{
 "contract": "jj.vehicle.v1",
 "id": "au-hawk",
 "units": "m",
 "forward": "+z",
 "up": "+y",
 "lods": [
  {
   "file": "au-hawk.lod0.glb",
   "maxTris": 3000
  },
  {
   "file": "au-hawk.lod1.glb",
   "maxTris": 900
  },
  {
   "file": "au-hawk.lod2.glb",
   "maxTris": 600
  }
 ],
 "parts": {
  "core": {
   "pivot": [
    0,
    0,
    0
   ],
   "hinge": null,
   "massFraction": 0.62,
   "collider": {
    "type": "convex"
   }
  },
  "front": {
   "pivot": [
    0,
    1.08475,
    0.97
   ],
   "hinge": {
    "axis": [
     1,
     0,
     0
    ],
    "min": 0,
    "max": 25
   },
   "massFraction": 0.08,
   "collider": {
    "type": "convex"
   }
  },
  "back": {
   "pivot": [
    0,
    1.0974444444444444,
    -0.97
   ],
   "hinge": {
    "axis": [
     1,
     0,
     0
    ],
    "min": -25,
    "max": 0
   },
   "massFraction": 0.07,
   "collider": {
    "type": "convex"
   }
  },
  "door_FL": {
   "pivot": [
    0.9785,
    0.5950000000000001,
    0.97
   ],
   "hinge": {
    "axis": [
     0,
     1,
     0
    ],
    "min": -70,
    "max": 0
   },
   "massFraction": 0.04,
   "collider": {
    "type": "convex"
   }
  },
  "door_FR": {
   "pivot": [
    -0.9785,
    0.5950000000000001,
    0.97
   ],
   "hinge": {
    "axis": [
     0,
     1,
     0
    ],
    "min": 0,
    "max": 70
   },
   "massFraction": 0.04,
   "collider": {
    "type": "convex"
   }
  },
  "door_RL": {
   "pivot": [
    0.9214285714285715,
    0.6034590643274854,
    -0.3
   ],
   "hinge": {
    "axis": [
     0,
     1,
     0
    ],
    "min": -70,
    "max": 0
   },
   "massFraction": 0.04,
   "collider": {
    "type": "convex"
   }
  },
  "door_RR": {
   "pivot": [
    -0.9214285714285715,
    0.6034590643274854,
    -0.3
   ],
   "hinge": {
    "axis": [
     0,
     1,
     0
    ],
    "min": 0,
    "max": 70
   },
   "massFraction": 0.04,
   "collider": {
    "type": "convex"
   }
  },
  "wheel_FL": {
   "pivot": [
    0.84,
    0.365,
    1.42
   ],
   "hinge": {
    "axis": [
     0,
     0,
     1
    ],
    "min": -6,
    "max": 6
   },
   "massFraction": 0.0175,
   "collider": {
    "type": "convex"
   }
  },
  "wheel_FR": {
   "pivot": [
    -0.84,
    0.365,
    1.42
   ],
   "hinge": {
    "axis": [
     0,
     0,
     1
    ],
    "min": -6,
    "max": 6
   },
   "massFraction": 0.0175,
   "collider": {
    "type": "convex"
   }
  },
  "wheel_RL": {
   "pivot": [
    0.84,
    0.365,
    -1.42
   ],
   "hinge": {
    "axis": [
     0,
     0,
     1
    ],
    "min": -6,
    "max": 6
   },
   "massFraction": 0.0175,
   "collider": {
    "type": "convex"
   }
  },
  "wheel_RR": {
   "pivot": [
    -0.84,
    0.365,
    -1.42
   ],
   "hinge": {
    "axis": [
     0,
     0,
     1
    ],
    "min": -6,
    "max": 6
   },
   "massFraction": 0.0175,
   "collider": {
    "type": "convex"
   }
  }
 },
 "interiors": {
  "engine": {
   "exposedBy": [
    "front"
   ]
  },
  "cabin": {
   "exposedBy": [
    "door_FL",
    "door_FR",
    "door_RL",
    "door_RR"
   ]
  },
  "boot": {
   "exposedBy": [
    "back"
   ]
  }
 },
 "anchors": {
  "cam_fp": [
   -0.38,
   1.3,
   -0.1
  ],
  "cam_tp_target": [
   0,
   1.15,
   0.4
  ],
  "com": [
   0,
   0.55,
   0
  ],
  "roof_number": [
   0,
   1.61,
   -0.3
  ],
  "lplate_front": [
   0,
   0.4,
   2.3
  ],
  "lplate_rear": [
   0,
   0.55,
   -2.3
  ]
 },
 "material": {
  "count": 1,
  "atlas": "au-hawk.atlas.png"
 }
}
